{
  "text.catalog": {
    "openai/gpt-5.5": {
      "id": "openai/gpt-5.5",
      "label": "GPT-5.5",
      "release": {
        "date": "2026-04-23",
        "basis": "model",
        "source_url": "https://openai.com/index/introducing-gpt-5-5/"
      },
      "multimodal": true,
      "image_input_mimes": [
        "image/png",
        "image/jpeg",
        "image/webp",
        "image/gif"
      ],
      "tool_call": true,
      "context_window": 1050000,
      "output_limit": 128000,
      "cost": {
        "input": 5,
        "output": 30,
        "cache_read": 0.5,
        "long_context": {
          "input_tokens_above": 272000,
          "input_multiplier": 2,
          "output_multiplier": 1.5
        }
      }
    },
    "openai/gpt-5.5-pro": {
      "id": "openai/gpt-5.5-pro",
      "label": "GPT-5.5 Pro",
      "release": {
        "date": "2026-04-23",
        "basis": "model",
        "source_url": "https://openai.com/index/introducing-gpt-5-5/"
      },
      "multimodal": true,
      "image_input_mimes": [
        "image/png",
        "image/jpeg",
        "image/webp",
        "image/gif"
      ],
      "tool_call": true,
      "context_window": 1050000,
      "output_limit": 128000,
      "cost": {
        "input": 30,
        "output": 180
      }
    },
    "openai/gpt-5.6-sol": {
      "id": "openai/gpt-5.6-sol",
      "label": "GPT-5.6 Sol",
      "release": {
        "date": "2026-07-09",
        "basis": "model",
        "source_url": "https://openai.com/index/gpt-5-6/"
      },
      "multimodal": true,
      "image_input_mimes": [
        "image/png",
        "image/jpeg",
        "image/webp",
        "image/gif"
      ],
      "tool_call": true,
      "context_window": 1050000,
      "output_limit": 128000,
      "cost": {
        "input": 4,
        "output": 20,
        "cache_read": 0.4,
        "cache_write": 5,
        "long_context": {
          "input_tokens_above": 272000,
          "input_multiplier": 2,
          "output_multiplier": 1.5
        }
      }
    },
    "openai/gpt-5.6-terra": {
      "id": "openai/gpt-5.6-terra",
      "label": "GPT-5.6 Terra",
      "release": {
        "date": "2026-07-09",
        "basis": "model",
        "source_url": "https://openai.com/index/gpt-5-6/"
      },
      "multimodal": true,
      "image_input_mimes": [
        "image/png",
        "image/jpeg",
        "image/webp",
        "image/gif"
      ],
      "tool_call": true,
      "context_window": 1050000,
      "output_limit": 128000,
      "cost": {
        "input": 2,
        "output": 12,
        "cache_read": 0.2,
        "cache_write": 2.5,
        "long_context": {
          "input_tokens_above": 272000,
          "input_multiplier": 2,
          "output_multiplier": 1.5
        }
      }
    },
    "openai/gpt-5.6-luna": {
      "id": "openai/gpt-5.6-luna",
      "label": "GPT-5.6 Luna",
      "release": {
        "date": "2026-07-09",
        "basis": "model",
        "source_url": "https://openai.com/index/gpt-5-6/"
      },
      "multimodal": true,
      "image_input_mimes": [
        "image/png",
        "image/jpeg",
        "image/webp",
        "image/gif"
      ],
      "tool_call": true,
      "context_window": 1050000,
      "output_limit": 128000,
      "cost": {
        "input": 0.2,
        "output": 1.2,
        "cache_read": 0.02,
        "cache_write": 0.25,
        "long_context": {
          "input_tokens_above": 272000,
          "input_multiplier": 2,
          "output_multiplier": 1.5
        }
      }
    },
    "openai/gpt-6-astra": {
      "id": "openai/gpt-6-astra",
      "label": "GPT-6 Astra",
      "release": {
        "date": "2026-09-04",
        "basis": "provider_endpoint",
        "source_url": "https://vercel.com/ai-gateway/models/gpt-6-astra"
      },
      "multimodal": true,
      "image_input_mimes": [
        "image/png",
        "image/jpeg",
        "image/webp",
        "image/gif"
      ],
      "tool_call": true,
      "context_window": 1050000,
      "output_limit": 128000,
      "cost": {
        "input": 10,
        "output": 50,
        "cache_read": 1,
        "cache_write": 12.5,
        "long_context": {
          "input_tokens_above": 272000,
          "input_multiplier": 2,
          "output_multiplier": 1.5
        }
      }
    },
    "anthropic/claude-sonnet-5": {
      "id": "anthropic/claude-sonnet-5",
      "label": "Claude Sonnet 5",
      "release": {
        "date": "2026-06-30",
        "basis": "model",
        "source_url": "https://platform.claude.com/docs/en/release-notes/overview"
      },
      "short_label": "Sonnet 5",
      "multimodal": true,
      "image_input_mimes": [
        "image/jpeg",
        "image/png",
        "image/gif",
        "image/webp"
      ],
      "tool_call": true,
      "context_window": 1000000,
      "output_limit": 128000,
      "cost": {
        "input": 2,
        "output": 10,
        "cache_read": 0.2,
        "cache_write": 2.5
      }
    },
    "anthropic/claude-fable-5.1": {
      "id": "anthropic/claude-fable-5.1",
      "label": "Claude Fable 5.1",
      "release": {
        "date": "2026-09-01",
        "basis": "model",
        "source_url": "https://platform.claude.com/docs/en/models/fable-5-1/overview"
      },
      "short_label": "Fable 5.1",
      "multimodal": true,
      "image_input_mimes": [
        "image/jpeg",
        "image/png",
        "image/gif",
        "image/webp"
      ],
      "tool_call": true,
      "context_window": 1000000,
      "output_limit": 128000,
      "cost": {
        "input": 10,
        "output": 50,
        "cache_read": 0.25,
        "cache_write": 12.5
      }
    },
    "anthropic/claude-fable-5": {
      "id": "anthropic/claude-fable-5",
      "label": "Claude Fable 5",
      "release": {
        "date": "2026-06-09",
        "basis": "model",
        "source_url": "https://platform.claude.com/docs/en/release-notes/overview"
      },
      "short_label": "Fable 5",
      "multimodal": true,
      "image_input_mimes": [
        "image/jpeg",
        "image/png",
        "image/gif",
        "image/webp"
      ],
      "tool_call": true,
      "context_window": 1000000,
      "output_limit": 128000,
      "cost": {
        "input": 10,
        "output": 50,
        "cache_read": 1,
        "cache_write": 12.5
      }
    },
    "anthropic/claude-opus-5": {
      "id": "anthropic/claude-opus-5",
      "label": "Claude Opus 5",
      "release": {
        "date": "2026-07-24",
        "basis": "model",
        "source_url": "https://platform.claude.com/docs/en/release-notes/overview"
      },
      "short_label": "Opus 5",
      "multimodal": true,
      "image_input_mimes": [
        "image/jpeg",
        "image/png",
        "image/gif",
        "image/webp"
      ],
      "tool_call": true,
      "context_window": 1000000,
      "output_limit": 128000,
      "cost": {
        "input": 5,
        "output": 25,
        "cache_read": 0.5,
        "cache_write": 6.25
      }
    },
    "anthropic/claude-opus-4.8": {
      "id": "anthropic/claude-opus-4.8",
      "label": "Claude Opus 4.8",
      "release": {
        "date": "2026-05-28",
        "basis": "model",
        "source_url": "https://platform.claude.com/docs/en/release-notes/overview"
      },
      "short_label": "Opus 4.8",
      "multimodal": true,
      "image_input_mimes": [
        "image/jpeg",
        "image/png",
        "image/gif",
        "image/webp"
      ],
      "tool_call": true,
      "context_window": 1000000,
      "output_limit": 128000,
      "cost": {
        "input": 5,
        "output": 25,
        "cache_read": 0.5,
        "cache_write": 6.25
      }
    },
    "google/gemini-3.8-flash": {
      "id": "google/gemini-3.8-flash",
      "label": "Gemini 3.8 Flash",
      "release": {
        "date": "2026-09-02",
        "basis": "model",
        "source_url": "https://ai.google.dev/gemini-api/docs/changelog"
      },
      "multimodal": true,
      "image_input_mimes": [
        "image/png",
        "image/jpeg",
        "image/webp",
        "image/heic",
        "image/heif"
      ],
      "tool_call": true,
      "context_window": 1048576,
      "output_limit": 65536,
      "cost": {
        "input": 1.5,
        "output": 7.5,
        "cache_read": 0.15
      }
    },
    "google/gemini-3.7-flash": {
      "id": "google/gemini-3.7-flash",
      "label": "Gemini 3.7 Flash",
      "release": {
        "date": "2026-08-13",
        "basis": "model",
        "source_url": "https://ai.google.dev/gemini-api/docs/changelog"
      },
      "multimodal": true,
      "image_input_mimes": [
        "image/png",
        "image/jpeg",
        "image/webp",
        "image/heic",
        "image/heif"
      ],
      "tool_call": true,
      "context_window": 1048576,
      "output_limit": 65536,
      "cost": {
        "input": 1.5,
        "output": 7.5,
        "cache_read": 0.15
      }
    },
    "google/gemini-3.1-pro-preview": {
      "id": "google/gemini-3.1-pro-preview",
      "label": "Gemini 3.1 Pro Preview",
      "release": {
        "date": "2026-02-19",
        "basis": "model",
        "source_url": "https://ai.google.dev/gemini-api/docs/changelog"
      },
      "short_label": "Gemini 3.1 Pro",
      "multimodal": true,
      "image_input_mimes": [
        "image/png",
        "image/jpeg",
        "image/webp",
        "image/heic",
        "image/heif"
      ],
      "tool_call": true,
      "context_window": 1048576,
      "output_limit": 65536,
      "cost": {
        "input": 2,
        "output": 12,
        "cache_read": 0.2,
        "long_context": {
          "input_tokens_above": 200000,
          "input_multiplier": 2,
          "output_multiplier": 1.5
        }
      }
    }
  },
  "image.models": {
    "openai/gpt-image-2": {
      "id": "openai/gpt-image-2",
      "label": "GPT Image 2",
      "release": {
        "date": "2026-04-21",
        "basis": "model",